,user,tweet_id,created_at,text
205,EconomicTimes,1298632543244345344,2020-08-26 14:45:00,"b'#Currency circulation in India increased in past few months, breaching the levels last seen before the end-2016 currency-swap programme, with the protracted lockdowns prompting residents to stock up on cash for stockpiling groceries and other essentials \n \nhttps://t.co/tMUwxluU9w'"
206,EconomicTimes,1298628768911818762,2020-08-26 14:30:00,"b'The government proposes to bring at least half a dozen #SocialSecurity schemes, including old age pension and insurance, under the ambit of the proposed social security code\n \nhttps://t.co/X4BgvFVF86'"
207,EconomicTimes,1298624993308401665,2020-08-26 14:15:00,"b'India must replicate the #Aadhaar model \xe2\x80\x94 built to enroll over a million people a day \xe2\x80\x94 to create a massive vaccination programme that can cover 3-5 million people daily, says @NandanNilekani \n\nhttps://t.co/daB1wEAaa9'"
208,EconomicTimes,1298622848357916674,2020-08-26 14:06:28,"b""Schools and colleges in #Odisha will remain closed till Durga Puja holidays, in view of ongoing #COVID19 pandemic: Chief Minister's Office\nTrack #Covid19 #LIVE news updates here https://t.co/JdXlDr9hLm"""
209,EconomicTimes,1298621940127522818,2020-08-26 14:02:52,"b""Is the pandemic fueling a resolve for innovation? Join the conversation with leading women innovators and nominees of @AccentureIndia 'Vaahini' Innovator of the Year category of #ETPWLA2020 - @anuacharya, @Jo4dev, and @Sairee. Register at https://t.co/T9DZrvnQpc \n@ETPrime_com https://t.co/3gr09d6X6P"""
210,EconomicTimes,1298621227142012931,2020-08-26 14:00:02,"b'In what could be early signs of formal #employment gaining ground, the number of subscribers who left and rejoined #EPF scheme stood at an all-time high so far this year in June, while the number of exits from the scheme dropped significantly\n\nhttps://t.co/FOaDaEhiPi'"
211,EconomicTimes,1298620294056169472,2020-08-26 13:56:19,"b'Emphasising that the triangle of innovators &amp; startups, industry and government is imperative to bring such solutions to scale, Goyal stated that such efforts can help to strengthen our \xe2\x80\x98transmission network.\n@PiyushGoyal\nhttps://t.co/mTXGvoWB4r'"
212,EconomicTimes,1298620031505375238,2020-08-26 13:55:17,b'.@PiyushGoyal said Indian Railways will be a 100 per cent electricity-driven rail network in coming years which would make it the largest such network in the world.\n\nhttps://t.co/d7VayRiU78'
213,EconomicTimes,1298619477563588608,2020-08-26 13:53:05,"b'According to the ratings agency, TCS is likely to face slower growth in revenue and profitability over the next 12-18 months, given subdued technology spending across the world.\n\n@TCS\nhttps://t.co/MILuZnm5Im'"
214,EconomicTimes,1298618778704416768,2020-08-26 13:50:18,"b""In a fresh development in the Sushant Singh Rajput death case, the Narcotics Control Bureau (NCB) has joined the probe into the late actor's death investigation.\n\n#SushantSinghRajput\nhttps://t.co/NbgsbbIohD"""
215,EconomicTimes,1298618020214890496,2020-08-26 13:47:17,"b""Bhargava said the auto industry's growth is entirely dependent on how well the other sectors of the economy perform, how well the people at large prosper and how well the #GDP increases.\n\nhttps://t.co/JNb51qtfcK"""
216,EconomicTimes,1298617443523235840,2020-08-26 13:45:00,"b'A government panel is preparing guidelines on addressing complications that arise in some people after they recover from #Covid19, a senior health ministry official said\n \nhttps://t.co/piwHzsB5p8'"
217,EconomicTimes,1298617288434675712,2020-08-26 13:44:23,"b'""So far we have induction cooking which takes long. Can we have fast cooking mechanisms to replace cooking gas because that is an imported product?,\xe2\x80\x9d Goyal said\n@PiyushGoyal\nhttps://t.co/u80oEKiyn8'"
218,EconomicTimes,1298616210477613056,2020-08-26 13:40:06,"b'The cumulative testing as on date has reached 3,76,51,512, with 8,23,992 tests being conducted in a span of 24 hours on Tuesday.\n\n#Covid19 \nhttps://t.co/NTgaZkmnCw'"
219,EconomicTimes,1298615557311221760,2020-08-26 13:37:30,"b'Major loss in subscriber base was recorded in the mobile telephony segment, with Bharti Airtel and Vodafone Idea losing around 47 lakh mobile customers each in May.\n\nhttps://t.co/rYCqigkH1G'"
220,EconomicTimes,1298615320823738369,2020-08-26 13:36:34,"b'The High Court has asked the chief secretary to come up with a ""roadmap"" in terms of the observations made by the court in the order to contain the contagion from now onwards\n\n#UttarPradesh\nhttps://t.co/dPkCxI5FrN'"
221,EconomicTimes,1298614873929035777,2020-08-26 13:34:47,"b'This system will enable any pensioner to obtain an instant printout of the latest copy of their PPO from their DigiLocker account, the ministry said.\n\nhttps://t.co/mDSRBTQkbi'"
222,EconomicTimes,1298614662355750912,2020-08-26 13:33:57,"b'""Our state is at the forefront of attracting FDI into the country, and I can assure you that we will set the benchmark as we progress beyond the COVID-19 phase,"" @BSYBJP said.\n\nhttps://t.co/vccGhJ99EO'"
223,EconomicTimes,1298613669803307008,2020-08-26 13:30:00,"b'#Women #entrepreneurship remains restricted in #India as more than 80% of ventures are dependent on family funds and limited network for sales, according to Global Alliance for Mass Entrepreneurship, an association of MSMEs\n \nhttps://t.co/tq9A8N787v'"
224,EconomicTimes,1298612639224872960,2020-08-26 13:25:54,b'In Pics: Banking on the government https://t.co/9ATISw0eG1'
225,EconomicTimes,1298609893814030339,2020-08-26 13:15:00,b'It\xe2\x80\x99s a taxman versus internet majors standoff\n \nhttps://t.co/aVO3FvDMlu'
226,EconomicTimes,1298606125454184449,2020-08-26 13:00:01,"b""England's James Anderson became the first seam bowler to reach 600 test wickets, reaching the milestone in a gloomy last session of a rain-hit final day of the third test against Pakistan\n \nhttps://t.co/AhaemoZaLN"""
227,EconomicTimes,1298602343622008832,2020-08-26 12:45:00,b'Media planners and advertisers do not expect the recent political controversy around the WSJ report to contribute to a dent in #AdSpends on #Facebook  \nhttps://t.co/O7a4hDbsKx'
228,EconomicTimes,1298599865899835392,2020-08-26 12:35:09,"b'Total lockdown in West Bengal on September 7, 11 and 12: Chief\nMinister Mamata Banerjee.\nTrack latest news updates here https://t.co/h73YUPYXNa https://t.co/g4qNT0iapS'"
229,EconomicTimes,1298598570744877059,2020-08-26 12:30:00,"b'The govt has extended the deadline for submitting expressions of interest in stake sale of #AirIndia by 2 months to October 30, while intimation to qualified bidders will be done by November 20\n \nhttps://t.co/5KoSAvtV9y'"
230,EconomicTimes,1298594793866563584,2020-08-26 12:15:00,"b'.@MoodysInvSvc said #India, #China and #Indonesia will be the only #G20 emerging economies to post a strong enough pick up of real #GDP in the second half of 2020, and retained its projection of 3.1 per cent growth contraction for India in 2020\n \nhttps://t.co/xzedqyzqfV'"
231,EconomicTimes,1298592426307682309,2020-08-26 12:05:35,b'In Pictures | \xe2\x80\x8bSpeculation rife https://t.co/W0SZyR5CHN'
232,EconomicTimes,1298591025812967429,2020-08-26 12:00:01,"b'Increasing number of examination centers, alternate seating plan, fewer candidates per room and staggered entry and exit are some steps the National Testing Agency will take for safely conducting medical and engineering entrance exams in September\n \nhttps://t.co/LAESkwcqhA'"
233,EconomicTimes,1298590998088491010,2020-08-26 11:59:55,b'In Pics: First pacer to 600 test wickets https://t.co/dAadChUjKI'
234,EconomicTimes,1298590830253363202,2020-08-26 11:59:15,b'RT @ET_RISE: Why the impact investment policy in the country needs a change? \n@stl_tech @akankshatweets_ #csr #covid19 https://t.co/lScFQXJ\xe2\x80\xa6'
235,EconomicTimes,1298590816819007491,2020-08-26 11:59:12,"b'RT @ET_RISE: With around 200 employees, the new entity has emerged as one of the largest #SaaS providers for the hospitality sector in the\xe2\x80\xa6'"
236,EconomicTimes,1298590491609411587,2020-08-26 11:57:54,"b'Odisha: Jajpur, Keonjhar districts badly affected due to heavy rains, IMD issues warning\nTrack latest news updates here https://t.co/h73YUPYXNa https://t.co/OrXibCjtN5'"
237,EconomicTimes,1298589464441192448,2020-08-26 11:53:49,b'US elections: Republican convention uplifts Trump supporters\nTrack latest news updates here https://t.co/h73YUPYXNa https://t.co/rxO43t3fzV'
238,EconomicTimes,1298587903107330055,2020-08-26 11:47:37,"b'COVID-19 pandemic: After months, Kerala\xe2\x80\x99s Sree Padmanabhaswamy temple opens for devotees\nTrack #Covid19 #LIVE news updates here https://t.co/JdXlDr9hLm https://t.co/YcD89hc3j3'"
239,EconomicTimes,1298587244505137152,2020-08-26 11:45:00,b'Corporates felt cheated as the restructuring did not give them a fair chance to put things back on the rails as policy flip-flops and the environment kept deteriorating each year \nhttps://t.co/fMiNHjDQHq'
240,EconomicTimes,1298585437133406208,2020-08-26 11:37:49,"b'GST Council meeting: Centre, states set to clash over compensation payment https://t.co/zLDRvJ4jdP https://t.co/9KRyYYgCBA'"
241,EconomicTimes,1298584254633267200,2020-08-26 11:33:07,"b'COVID-19 testing to be doubled, says Arvind Kejriwal as cases rise in Delhi https://t.co/wVn9E5WHZo https://t.co/1tujz8nrzO'"
242,EconomicTimes,1298583470814498817,2020-08-26 11:30:00,"b'Tim Sweeney, chief executive and founder of video game maker Epic Games, has antagonized the world\xe2\x80\x99s most powerful technology giants since at least 2016\n  \nhttps://t.co/SPjK0cWy1V'"
243,EconomicTimes,1298581798444662784,2020-08-26 11:23:21,b'In Pics: Facelift https://t.co/Xq8NaZenC0'
244,EconomicTimes,1298579905098035201,2020-08-26 11:15:50,b'Mohammad Faizi has not received his salary since March and is unable to pay school fee of his two daughters.\n\nhttps://t.co/phQ2L20kdJ'
245,EconomicTimes,1298579694841786368,2020-08-26 11:15:00,"b'Both, adults and children, are taking to eSports and casual gaming like never before \nhttps://t.co/xGrJU7IgBc'"
246,EconomicTimes,1298579694837567488,2020-08-26 11:15:00,b'Pre-packaged insolvency resolution framework could make a debut in the MSME segment before being expanded to other sectors\n \nhttps://t.co/rcvHXf2ePd'
247,EconomicTimes,1298579646020165632,2020-08-26 11:14:48,"b""Australian run-machine Steve Smith continued to top the chart in Tests and he is followed by Kohli and Smith's compatriot Marnus Labuschagne.\n\nhttps://t.co/G1yxHfhTI9"""
248,EconomicTimes,1298578161119064064,2020-08-26 11:08:54,"b'In her introductory remarks, Sonia Gandhi said she agreed with Banerjee and Thackeray that all opposition-ruled states should together fight the Centre for their rights.\n\n@MamataOfficial #UddhavThackeray #SoniaGandhi  \nhttps://t.co/51ENnxm2y9'"
249,EconomicTimes,1298577869052862465,2020-08-26 11:07:45,"b'India\xe2\x80\x99s Tata Group, the sprawling $111 billion jewelry-to-salt empire, is getting a huge digital makeover.\n\nhttps://t.co/UuM1HWYr7e'"
250,EconomicTimes,1298577561115484162,2020-08-26 11:06:31,b'Tata Starbucks has also launched its first drive-thru store in India at the Ambala Chandigarh Expressway in Zirakpur.\n\nhttps://t.co/yAs7uxd2PK'
251,EconomicTimes,1298575921029545986,2020-08-26 11:00:00,"b'#TwoWheelers are neither a luxury nor sin goods and so merit a #GST rate revision, FM Sitharaman said at an industry interaction\n \nhttps://t.co/Y0O9p4b3mY'"
252,EconomicTimes,1298575002397110272,2020-08-26 10:56:21,"b'Income tax refunds of Rs 29,361 crore have been issued in 23,91,517 cases &amp; corporate tax refunds of Rs 66,493 crore have been issued in 1,63,272 cases\n\n#ITR \nhttps://t.co/wmcrB3eaJ8'"
253,EconomicTimes,1298574700826640389,2020-08-26 10:55:09,"b""Rao's comments come in the wake of growing clamour for postponing the two crucial exams in the wake of rise in COVID-19 cases.\n\n#Covid19 #JEE_NEET\nhttps://t.co/DwlDPvzKwr"""
254,EconomicTimes,1298574303500185600,2020-08-26 10:53:34,b'Facebook refers to the new product as a \xe2\x80\x98personalised\xe2\x80\x99 destination for news within Facebook with users getting top headlines and stories for the day based on their interests.\n@Facebook\n\nhttps://t.co/9iMSrIZZpm'
255,EconomicTimes,1298574167445393408,2020-08-26 10:53:02,b'Centre is likely to tell states that they should borrow individually from the markets instead of the central government taking the route.\n\nhttps://t.co/PgoIoERJtq'
256,EconomicTimes,1298573968438222849,2020-08-26 10:52:15,"b""Dubey's letter came a day after Lok Sabha Speaker Om Birla issued an advisory to chairmen of all parliamentary panels asking them to strictly adhere to rules and regulations while conducting committee meetings.\n @ShashiTharoor\n\nhttps://t.co/w6spvdYYkI"""
257,EconomicTimes,1298572144704491521,2020-08-26 10:45:00,"b'""The Covid-19 crisis means Indias GDP will crash this year by anywhere from 5% to 10%. Government revenues are collapsing, while emergency relief spending will vastly exceed any spending cuts or new taxes on oil."" \nhttps://t.co/RU3Hw8ObKw'"
258,EconomicTimes,1298571812482060291,2020-08-26 10:43:41,"b'RT @ET_RISE: Over the past decade, @amazon has woven itself into the fabric of #Indian life. \n#hyderabad @CAITIndia @praveendel @satish_49\xe2\x80\xa6'"
259,EconomicTimes,1298571798728957952,2020-08-26 10:43:37,"b'RT @ET_RISE: .@seedtoscale includes @Accel\xe2\x80\x99s podcasts, as well as focussed programmes for founders. \n#startups #venturecapital #entrepreneu\xe2\x80\xa6'"
260,EconomicTimes,1298568372230279168,2020-08-26 10:30:00,"b'Facing political heat in India, the social networking giant said it will pay #news publishers in the country soon via its #FacebookNews to ensure their content is available in the new product\n \nhttps://t.co/N88W1s2fYX'"
261,EconomicTimes,1298564595066368001,2020-08-26 10:15:00,"b'US consumer confidence continued to deteriorate in August, falling below the level seen in the early weeks of the pandemic as coronavirus cases rise\n \nhttps://t.co/KgagbOb6Wh'"
262,EconomicTimes,1298560825083351040,2020-08-26 10:00:01,b'The govt is planning to crackdown on those farmers who are illegally receiving benefits of PM-KISAN scheme by concealing facts that make them ineligible\n \nhttps://t.co/pJb3uUW2A1'
263,EconomicTimes,1298560822994591744,2020-08-26 10:00:00,"b'#AmericanAirlines said its workforce will shrink by 40,000, including 19,000 involuntary cuts, in October as the #COVID19 pandemic continues to weigh on air travel, unless the govt extends aid for airline employee payrolls\n \nhttps://t.co/Sp657f8IrX'"
264,EconomicTimes,1298559657389068289,2020-08-26 09:55:23,b'RT @ETPanache: Counsel for Netflix said that it was highly unlikely that the series would be shown to Choksi prior release.\n\n#Netflix #Mehu\xe2\x80\xa6'
265,EconomicTimes,1298559475427598337,2020-08-26 09:54:39,b'#Uber on Wednesday launched an on demand 24x7 #AutoRentals service in #India \n \nhttps://t.co/xzBcSvji0f'
266,EconomicTimes,1298559336319311872,2020-08-26 09:54:06,b'Honda Cars India Ltd has launched an updated version of its premium hatchback Jazz with price starting at Rs 7.5 lakh (ex-showroom Delhi)\n \nhttps://t.co/vqY7xOsEkO'
267,EconomicTimes,1298559020735725568,2020-08-26 09:52:51,"b""Spooked by Netflix\xe2\x80\x99s upcoming web series titled 'Bad Boy Billionaires' featuring Vijay Mallya, Subrata Roy, Harshad Mehta and his nephew Nirav Modi, Mehul Choksi petitioned Delhi High Court seeking directions to show him the series before release\n \nhttps://t.co/LouvrI7p59"""
268,EconomicTimes,1298558791827349506,2020-08-26 09:51:56,"b'Cybersecurity firm Seqrite said ransomware attacks doubled year-on-year in the first quarter of this financial year to 400,000 largely due to the absence of robust cybersecurity measures amid a surge in remote working in the wake of Covid-19\n \nhttps://t.co/QnoEfwSuq9'"
269,EconomicTimes,1298558667566886914,2020-08-26 09:51:27,"b'A 40-year-old man has been arrested for creating a fake Facebook page in the name of Bengaluru City Police, police said\n \nhttps://t.co/bwNWulJwYO'"
270,EconomicTimes,1298558575929749505,2020-08-26 09:51:05,"b""Gujarat has topped the Niti Aayog's Export Preparedness Index 2020 followed by Maharashtra and Tamil Nadu in the second and third place respectively, according to the government think tank's report\n \nhttps://t.co/ArmLNRtEZz"""
271,EconomicTimes,1298558463119777792,2020-08-26 09:50:38,"b'The department of commerce is proactively engaging with state governments to promote exports, Commerce Secretary Anup Wadhawan said\n \nhttps://t.co/hAoLyutqnl'"
272,EconomicTimes,1298558102845849601,2020-08-26 09:49:12,"b'The Bollywood actor, along with PHD Chamber of Commerce and Industry (PHDCCI) chairman, Karan Gilhotra, decided to distribute smartphones to students of Government Senior Secondary School at Morni\xe2\x80\x99s Koti village, Haryana\n \nhttps://t.co/fXtZ16EF6U'"
273,EconomicTimes,1298557918959214593,2020-08-26 09:48:28,"b""A judge on Tuesday denied #RomanPolanski's request to restore his membership in the organisation that bestows the Academy Awards two years after he was expelled from it for raping a minor \nhttps://t.co/8yCJuExAN4"""
274,EconomicTimes,1298557500417912832,2020-08-26 09:46:48,b'In Pics | Twin Russian military forums to strengthen defence cooperation among nations\nhttps://t.co/mqO6e9bFMX'
275,EconomicTimes,1298557423616057345,2020-08-26 09:46:30,"b'In Pics | Samsung, Huawei fight for top spot as COVID-19 hits global smartphone sales\nhttps://t.co/0LpPwpem50'"
276,EconomicTimes,1298557383401037824,2020-08-26 09:46:20,b'In Pics | #MukeshAmbani has big ambitions for e-retail\nhttps://t.co/FWJ9gTkaeg'
277,EconomicTimes,1298557045080195075,2020-08-26 09:45:00,b'India may soon be able to carry out saliva-based #tests for #Covid19 #diagnosis if the govt approves the process that is considered safer for healthcare workers and less discomforting for individuals\n \nhttps://t.co/k7IToZHlj2'
278,EconomicTimes,1298553270839857152,2020-08-26 09:30:00,"b""After India eased a nationwide lockdown in early June, epidemiologists and government officials involved in #Bengaluru's response to the #pandemic said they realised they had not planned enough \n \nhttps://t.co/i7VP0t1IMm"""
279,EconomicTimes,1298551286732734464,2020-08-26 09:22:07,b'Advertorial | An all-new SpaceMax Family Hub\xe2\x84\xa2 from Samsung that transforms your living space into a zone of connected living and some quality family time. #FamilyHub     https://t.co/yMK1Y68AU8'
280,EconomicTimes,1298549495307747328,2020-08-26 09:15:00,"b'Novartis Technical Operations, which encompasses the manufacturing and supply chain sites of the pharma giant, plans to hire more for its Hyderabad base by end of year, said Amit Nastik, global head, NTO strategy and operations and local market mfg\n\nhttps://t.co/5UKJ0cONPR'"
281,EconomicTimes,1298545728134844416,2020-08-26 09:00:02,b'#RBI has prescribed several #reforms to get the economy back on the rails after the rollback of various stimulus measures taken to counter the lockdown-induced economic damage\n \nhttps://t.co/oUT9OO3c7f'
282,EconomicTimes,1298543341550751744,2020-08-26 08:50:33,"b'State government to resume renewal of existing Inner Line Permits (ILPs) and issue temporary ILPs from 1st September 2020: Civil Secretariat, Government of Arunachal Pradesh https://t.co/KTGzLcNPeL'"
283,EconomicTimes,1298543153784320000,2020-08-26 08:49:48,"b""Haryana: Sonu Sood provides smartphones to school students in Panchkula | Catch the day's #news #updates here: https://t.co/jzRXcih6hB https://t.co/KRZJSpZzWx"""
284,EconomicTimes,1298542722467258369,2020-08-26 08:48:05,"b""#MelaniaTrump urges unity, says #Trump 'best' for US | Catch the day's #news #updates here: https://t.co/jzRXcih6hB https://t.co/EHh4EdC6v9"""
285,EconomicTimes,1298542196371595264,2020-08-26 08:46:00,"b'Why Centre is forcing students to take exams during pandemic, asks Manish Sisodia | #Coronavirus LIVE updates: https://t.co/GtLt7bKzns https://t.co/9pdcpJydAN'"
286,EconomicTimes,1298541979907719168,2020-08-26 08:45:08,"b'COVID-19 tests in Delhi will be doubled to 40,000 per day within a week as there has been a marginal increase in the number of coronavirus cases in the city, Chief Minister @ArvindKejriwal said\n \nhttps://t.co/kBFU222Jgf'"
287,EconomicTimes,1298541945506025472,2020-08-26 08:45:00,"b'#India and its key SE Asian partner #Vietnam have decided to explore closer cooperation in emerging areas \xe2\x80\x94 civil nuclear energy, space, marine sciences and new technologies, and decided to expand their Indo-Pacific partnership\n \nhttps://t.co/I63vWiLmkK'"
288,EconomicTimes,1298541834596098049,2020-08-26 08:44:33,"b""Accenture which has over 5 lakh employees worldwide is to cut at least 5 per cent of its 'low-performing workforce and thousands of Indians are set to lose jobs owing to the sluggish business the company is witnessing during the Covid-19 pandemic\n \nhttps://t.co/0MLuStJoCj"""
289,EconomicTimes,1298541637459521536,2020-08-26 08:43:46,"b'India was likely to see its lowest point of growth this year during the April-June quarter at -15.2%, according to a Nomura report\n \nhttps://t.co/HHp0NSVeoB'"
290,EconomicTimes,1298541513224237056,2020-08-26 08:43:17,"b'N95 masks may be the most effective at reducing the spread of the novel coronavirus, according a study by researchers, including those from the Indian Space Research Organisation  \n \nhttps://t.co/ZNEtwwK95T'"
291,EconomicTimes,1298541356944506880,2020-08-26 08:42:39,"b'Venture capital fund Sequoia Capital India is the top backer of unicorns, or firms which have attained a valuation of over $1 billion\n \nhttps://t.co/F8GgzdbAxn'"
292,EconomicTimes,1298538258083672064,2020-08-26 08:30:21,"b'RT @ET_Wealth: Rs 2,000 #notes were not printed in 2019-20: @RBI #annual #report\n#currency #money #RBI \nhttps://t.co/fsqxzzo8Lm'"
293,EconomicTimes,1298538246218031106,2020-08-26 08:30:18,"b'RT @ETPanache: #Fitbit also announced the #Versa3 smartwatch, priced at $229 and upgraded from its predecessor to include a #GPS sensor and\xe2\x80\xa6'"
294,EconomicTimes,1298538171446132737,2020-08-26 08:30:00,"b'#Telangana said Tuesday it saw at least two cases of #coronavirus #reinfection in the state, raising worries that those who have recovered from the disease may not be immune to future infections\n \nhttps://t.co/gwccgFRY8v'"
295,EconomicTimes,1298537939115237377,2020-08-26 08:29:05,"b'Describing himself as a ""centre-left thinking person"", BJP MP Varun Gandhi says in a new book that he is not a right wing person by nature and his writings are evidence of his ""consistently progressive liberal record""\n \nhttps://t.co/eBgSyonQTO'"
296,EconomicTimes,1298537666242162688,2020-08-26 08:27:59,"b'India needs to sustain 8-8.5% annual growth to gainfully employ the 60 million new workers expected to join the workforce by 2030, according to a McKinsey report\n \nhttps://t.co/4WscErl4dY'"
297,EconomicTimes,1298537257708609537,2020-08-26 08:26:22,"b'In Pics | Meet this Math wizard, quicker than a calculator\nhttps://t.co/BPze7gHwOa'"
298,EconomicTimes,1298535950545350656,2020-08-26 08:21:10,"b""The govt's debt rose to 75% of GDP in FY20 from 70% in FY18 and is likely to reach 91% in FY21, according to estimates from the EcoScope report of Motilal Oswal Financial Services\n  \nhttps://t.co/gv0wazV0v5"""
299,EconomicTimes,1298535709964263424,2020-08-26 08:20:13,"b'RT @ET_RISE: .@PalantirTech said it has 125 customers using its software across more than 150 countries, with the average revenue per custo\xe2\x80\xa6'"
300,EconomicTimes,1298535641173483520,2020-08-26 08:19:57,"b'States must set up dedicated export depts and re-look at the composition of exports with focus on labour intensive sectors, @NITIAayog vice chairman Rajiv Kumar said   \nhttps://t.co/yLjJnkSjOL'"
301,EconomicTimes,1298534396077760520,2020-08-26 08:15:00,b'Global investors Abu Dhabi Investment Authority and Canada\xe2\x80\x99s Public Sector Pension Investments have written to the GoI seeking a fair and transparent solution to the ongoing #takeover drama surrounding Mumbai International Airport Ltd \nhttps://t.co/kqgROVFN3z'
302,EconomicTimes,1298533940089597960,2020-08-26 08:13:11,"b""Fugitive diamantaire #MehulChoksi approaches Delhi High Court against @netflix's upcoming web series 'Bad Boy Billionaires', through advocate Vijay Aggarwal. Hearing shortly. https://t.co/R1KM0AGB8j"""
303,EconomicTimes,1298532838858317824,2020-08-26 08:08:49,"b'Congress leader @priyankagandhi on Wednesday urged #UttarPradesh Governor @anandibenpatel to take cognizance of the situation of women\'s safety in the state which she alleged had become ""very bad""\n \nhttps://t.co/dlm2XRdwNH'"
304,EconomicTimes,1298532614869942272,2020-08-26 08:07:55,"b'In Pics | 1,500% return in 5 months! Should you pick penny stocks? https://t.co/aqZ9msk9mV'"
305,EconomicTimes,1298532557017894914,2020-08-26 08:07:41,b'In Pics | 14 stocks that analysts say can offer solid gains over 2-3 weeks https://t.co/JqF2jiB7Wt'
306,EconomicTimes,1298532036529934336,2020-08-26 08:05:37,b'There has been an increase in #COVID19 cases in last few days. Recovery rate is more than 90% in the national capital. We are fully prepared. I have directed that number of tests will be doubled in coming days: CM Arvind Kejriwal\n#Coronavirus LIVE updates: https://t.co/GtLt7bKzns https://t.co/fIvtOBJnIg'
307,EconomicTimes,1298531747391401985,2020-08-26 08:04:28,"b'I think the Central Govt should postpone the #NEET and #JEE exams or they should find an alternative way of conducting the exams. Examination system across the world is evolving, there are 1000 alternate ways to conduct exams: Delhi Deputy CM &amp; Education Minister @msisodia https://t.co/s3HBBDFZQC'"
