,user,tweet_id,created_at,text
308,EconomicTimes,1298531394583371776,2020-08-26 08:03:04,b'Opposition Leader Ramesh Chennithala writes to Kerala Governor Arif Mohammad Khan over the fire incident at Secretariat https://t.co/oSwTByKdFZ'
309,EconomicTimes,1298531016273850369,2020-08-26 08:01:34,"b""West Bengal: Special prayers offered in Siliguri's Pradhan Nagar, on the birth anniversary of #MotherTeresa  \n\nCatch the day's #news #updates here: https://t.co/jzRXcih6hB https://t.co/NAZ8mH2sDv"""
310,EconomicTimes,1298530622240182273,2020-08-26 08:00:00,"b'Twelve rain-related deaths were reported in Gujarat and four from J&amp;K on Tuesday, even as very heavy downpour was predicted in the east, north and the central parts of the country over the next 5 days\nhttps://t.co/MAkLkfU1nV'"
311,EconomicTimes,1298528789249441794,2020-08-26 07:52:43,"b'Sri Lanka wants to pursue a \xe2\x80\x9cneutral\xe2\x80\x9d foreign policy but will retain an \xe2\x80\x9cIndia First\xe2\x80\x9d approach in strategic and security matters, foreign secretary Jayanath Colombage has said\n \nhttps://t.co/bwc4bleYFb'"
312,EconomicTimes,1298527240259420161,2020-08-26 07:46:34,b'Nobody was injured in the incident and 10 persons trapped inside the building were rescued\n \nhttps://t.co/rXpU2jLPzc'
313,EconomicTimes,1298527025896906752,2020-08-26 07:45:43,"b'Haryana Agriculture Minister J P Dalal has tested positive for COVID-19, he said in a tweet on Wednesday, making him the eighth legislator of the ruling BJP in the state to contract the infection\n \nhttps://t.co/AzvccOcRMu'"
314,EconomicTimes,1298526846150049792,2020-08-26 07:45:00,"b'Video clips, WhatsApp chats and photographs retrieved from a damaged mobile phone helped the #NIA nail the conspiracy behind the 2019 #PulwamaSuicideAttack\n \nhttps://t.co/f5uw6QLVV6'"
315,EconomicTimes,1298526165166985217,2020-08-26 07:42:17,"b""SC took note of the Centre's alleged inaction and asked it to clarify its stand within a week on the waiver of interest on interest for deferred payments of instalments for loans during the moratorium period announced due to the coronavirus lockdown\n \nhttps://t.co/bE35iu44Dg"""
316,EconomicTimes,1298525727793455105,2020-08-26 07:40:33,"b'""I just borrowed money from wherever I could, I had to save my daughter,"" said Lal. ""If I had access to my own money, I\'d not have been ashamed.""\n \nhttps://t.co/G5K6TEbJCx'"
317,EconomicTimes,1298525472712560640,2020-08-26 07:39:32,"b'Delhi High Court declined to entertain a PIL opposing the decision of the #ICAI to transfer Rs 15 crore to the #PMCARESFund, saying it appeared to be a ""motivated"" plea against the president of the institution\n \nhttps://t.co/avOtpYDEB7'"
318,EconomicTimes,1298525238141972481,2020-08-26 07:38:36,"b'RT @ETMarkets: Investors around the globe would be glued to the event keenly this year, hoping for US Federal Reserve Chair #JeromePowell t\xe2\x80\xa6'"
319,EconomicTimes,1298523416346030080,2020-08-26 07:31:22,"b'#LeadStoryOnET | #Aircel rescue falters at the final hurdle, grim tidings for #RCom https://t.co/bHVhoXy5cM'"
320,EconomicTimes,1298523202973384704,2020-08-26 07:30:31,"b""RT @ETPanache: #ShareChat has entered into an agreement with #TSeries to license its music catalogue on the social media company's platform\xe2\x80\xa6"""
321,EconomicTimes,1298523188150722560,2020-08-26 07:30:28,"b'RT @ET_RISE: .@Exprs enables last yard deliveries from campus gates to customer doorsteps, helping them improve efficiency and save costs.\xe2\x80\xa6'"
322,EconomicTimes,1298523170098434048,2020-08-26 07:30:23,b'RT @ET_Wealth: #FacialRecognition and #IrisScans  may be used for #welfare scheme payouts\n#payments #authentication  @UIDAI @NPCI_NPCI \nhtt\xe2\x80\xa6'
323,EconomicTimes,1298523131825405964,2020-08-26 07:30:14,"b""SC pulls up Centre for allowing #banks to charge interest on interest during #LoanMoratorium period | Catch the day's #news #updates here: https://t.co/jzRXcih6hB https://t.co/bGitcW1FDO"""
324,EconomicTimes,1298523071582593024,2020-08-26 07:30:00,b'Forwards premium across maturities jumped up to 36 basis points in the past 2-3 weeks as overseas borrowers/importers rushed to buy future contracts amid signs of the #rupee gaining against the dollar \nhttps://t.co/qBPed1zDPp'
325,EconomicTimes,1298522267270275072,2020-08-26 07:26:48,"b""Madhya Pradesh CM Shivraj Singh Chouhan announces financial assistance of Rs 8.95 lakhs to the kin of the people who lost their lives in a building collapse in Dewas: Chief Minister's Office\nCatch the day's #news #updates here: https://t.co/jzRXcih6hB https://t.co/2JbMXvRP7J"""
326,EconomicTimes,1298521911844941826,2020-08-26 07:25:23,"b'Union Health Minister Dr Harsh Vardhan today inaugurated two new Medical Colleges at Bharatpur &amp; Bhilwara, Rajasthan &amp; also Superspeciality Blocks in Govt Medical Colleges at Udaipur, Bikaner &amp; Kota, via video conferencing https://t.co/eq1pXM0t5V'"
327,EconomicTimes,1298521759293947905,2020-08-26 07:24:47,"b""Vedanta files an appeal before the Supreme Court challenging the August 18 order of the Madras High court, which had rejected Vedanta's plea seeking permission to reopen Sterlite Copper Plant at Thoothukudi https://t.co/XSZi2E9ol1"""
328,EconomicTimes,1298519296318947328,2020-08-26 07:15:00,b'The exercise is part of the revamp that #EdelweissGroup initiated after the IL&amp;FS defaults in 2018 led to a liquidity crunch in shadow banking and sticky loans to cos and the real estate sector ballooned at the 25-year-old financial services co \nhttps://t.co/i4AXTFYKAZ'
329,EconomicTimes,1298515525354418179,2020-08-26 07:00:01,b'Suggestions made by the expert committee include increasing credit guarantee cover to 75% of the amount in default and increasing collateral-free loans to \xe2\x82\xb920 lakh for lending to MSMEs and self-help groups https://t.co/S55gpRPVgo'
330,EconomicTimes,1298515451849265153,2020-08-26 06:59:43,b'Former Assam Chief Minister Tarun Gogoi tests positive for #Covid19 \n\n#Coronavirus LIVE updates: https://t.co/GtLt7bKzns https://t.co/z7SyLsrCt0'
331,EconomicTimes,1298514795415519233,2020-08-26 06:57:07,b'RT @ET_Wealth: #SupremeCourt asks #SBI Capital to fund 6 #Amrapali Group #housing projects\n#realestate #homebuyers\nhttps://t.co/jK3Appwmsj'
332,EconomicTimes,1298514750649692162,2020-08-26 06:56:56,b'RT @ET_Wealth: What to check in your Form-16 while filing #ITR\n#taxpayers #IncomeTaxReturns #IncomeTax #taxes \nhttps://t.co/UdpqIhi7q8'
333,EconomicTimes,1298511746550788099,2020-08-26 06:45:00,b'The development assumes significance amid weakness in the broader economy as fund managers say companies need strong boards to get through the current turbulence\nhttps://t.co/THJrie1S3r'
334,EconomicTimes,1298508876354949120,2020-08-26 06:33:35,"b'RT @ET_RISE: While the pandemic has changed the dynamics of #education, the repeated postponement of competitive exams have left candidates\xe2\x80\xa6'"
335,EconomicTimes,1298507972830572544,2020-08-26 06:30:00,"b'When the British govt told people they no longer had to stay home, it needed a convincing pitch to get everyone back outside and, crucially, spending money\n \nhttps://t.co/Uvhm7vjBSn'"
336,EconomicTimes,1298507350353952768,2020-08-26 06:27:32,"b'#SupremeCourt defers the hearing for two weeks on the petition filed by JNU student, #SharjeelImam, seeking a direction from the SC for clubbing of multiple FIRs lodged against him in various states, for his alleged inflammatory speech at an #AntiCAAProtest last year https://t.co/QaOeB7hHhv'"
337,EconomicTimes,1298506888787554305,2020-08-26 06:25:42,"b'Delhi Metro Rail Corporation (#DMRC) is completely prepared to resume operations with all safeguards and arrangements in place for commuters, if it is allowed to function when #Unlock 4.0 kicks in \n \nhttps://t.co/lhHl1k3Nk3'"
338,EconomicTimes,1298506512671707136,2020-08-26 06:24:12,b'Congress leader Rahul Gandhi on Wednesday attacked the government over the state of the economy and said it needs to give money to the poor to restart the economy through consumption\n \nhttps://t.co/nWcQ6jcmtR'
339,EconomicTimes,1298506279338483712,2020-08-26 06:23:16,"b""Amid deepening desperation, the story of those who won't wait for superpowers\xe2\x80\x99 #Covid #vaccines https://t.co/M5rTHMQgB0 https://t.co/aKHvExpoUa"""
340,EconomicTimes,1298505199225458690,2020-08-26 06:18:59,"b'Senior Congress leader Kapil Sibal, one of the 23 leaders who have written to party chief Sonia Gandhi seeking an organisational overhaul, said on Wednesday that when fighting for principles, opposition is often voluntary and support is often managed\n \nhttps://t.co/EJuRzNG9r7'"
341,EconomicTimes,1298505062755385344,2020-08-26 06:18:26,"b'Andhra Pradesh, Karnataka and Tamil Nadu have been able to either reduce their death rates or keep them flat in the past two weeks, according to the trends compiled by the Karnataka Covid-19 War Room\n \nhttps://t.co/lHPOwpUbQe'"
342,EconomicTimes,1298504196845703168,2020-08-26 06:15:00,"b'""Overall investments of the group have reduced by 50 per cent during this fiscal year, and we will continue to manage this tightly going forward.""\n \nhttps://t.co/2k4HEsNRls'"
343,EconomicTimes,1298503510057562113,2020-08-26 06:12:16,"b'Supreme Court on Tuesday asked SBI Capital to begin funding for six housing projects of the Amrapali Group, after it informed the top court that so far, it has found only these six to be viable\n \nhttps://t.co/hXQDJ7K82v'"
344,EconomicTimes,1298503109740617729,2020-08-26 06:10:41,"b'#Covid19: #India reports 67,151 new cases in 24 hrs; tally crosses 32 lakh mark https://t.co/ItxsA22Ce9 https://t.co/armZ9qj7CA'"
345,EconomicTimes,1298502979536871424,2020-08-26 06:10:09,"b""Kerala secretariat fire: Opposition alleges attempt to sabotage Gold Smuggling case evidence | Catch the day's #news #updates here: https://t.co/jzRXcih6hB https://t.co/3vyvGnqkcO"""
346,EconomicTimes,1298500693754441728,2020-08-26 06:01:05,b'Delhi Chief Minister Arvind Kejriwal holds a meeting with Health Minister Satyendra Jain and other officials over the increase in number of #COVID19 cases in the national capital \n#Coronavirus LIVE updates: https://t.co/GtLt7bKzns https://t.co/A2PYM7X0F8'
347,EconomicTimes,1298500424429953024,2020-08-26 06:00:00,"b'Congress\xe2\x80\x99 pro-change leaders, whose joint letter triggered a storm, had asked interim party president Sonia Gandhi in the letter to \xe2\x80\x9cbring all ex-Congress leaders/persons\xe2\x80\x9d on one platform, according to AICC sources\n \nhttps://t.co/7OS1KFZhdh'"
348,EconomicTimes,1298500368322576384,2020-08-26 05:59:47,b'RT @ETMarkets: JUST IN | #Affle wins contract for Singapore-citizens-engagement project: Agencies'
349,EconomicTimes,1298498031533219846,2020-08-26 05:50:30,b'Supreme Court asks Centre to file a reply and make its stand clear on giving moratorium on charging interest on loan as well as interest-on-interest during moratorium period declared during #COVID19 pandemic. The matter to be heard next on September 1. https://t.co/oH3GXiLkG6'
350,EconomicTimes,1298496647031336960,2020-08-26 05:45:00,"b""#ICICIBank has begun using satellite images of farmland to help assess farmers' credit-worthiness, a move the bank says is helping cut travel costs and make faster lending decisions in a world hit by the #COVID19 pandemic\n \nhttps://t.co/B9WDzASIjb"""
351,EconomicTimes,1298492990093062144,2020-08-26 05:30:28,"b""RT @ETPanache: The BBC statement didn't directly address the controversy, but said the decision reflected ''this extraordinary year'' and t\xe2\x80\xa6"""
352,EconomicTimes,1298492934552051714,2020-08-26 05:30:15,"b""In Pics | #India nails #Pakistan's lies at United Nations \nhttps://t.co/JRnbNkLFg8"""
353,EconomicTimes,1298492872694444033,2020-08-26 05:30:00,b'#LeadStoryOnET | #FacialRecognition and #IrisScans could soon be used for #Aadhaar authentication of beneficiaries using #JanDhan bank accounts to access government Direct Benefit Transfer (#DBT) payouts and domestic transfers\n \nhttps://t.co/hqn49HMTsU'
354,EconomicTimes,1298490790428028928,2020-08-26 05:21:43,"b""JEE-NEET exams: Amid students' stir, NTA issues guidelines; Greta Thunberg joins postponement chorus | https://t.co/5hf55J612O https://t.co/TuSVLL9jl5"""
355,EconomicTimes,1298490154462535681,2020-08-26 05:19:12,b'#PrashantBhushan #contempt case: SC reserves order on quantum of sentence https://t.co/N9yDmx49wX https://t.co/MQdon8wBff'
356,EconomicTimes,1298489909888442368,2020-08-26 05:18:13,b'#ICICIBank introduces use of satellite data to assess farm loans https://t.co/DTk6yuF8LR https://t.co/JjrQHSOaPp'
357,EconomicTimes,1298489695886667776,2020-08-26 05:17:22,"b'#RBI announces special OMO of Rs 20,000 crore in 2 tranches https://t.co/i3yeKglYcX https://t.co/Qbs0lZNGyY'"
358,EconomicTimes,1298489513765818368,2020-08-26 05:16:39,"b""#AirIndia disinvestment: Govt extends deadline for expression of interest to October 30 | Catch the day's #news #updates here: https://t.co/jzRXcih6hB https://t.co/K2SYcKINbK"""
359,EconomicTimes,1298489356940845056,2020-08-26 05:16:02,"b'#Covid19: Govt amends #CSR norms; likely to help boost funding for vaccines, drugs | #Coronavirus LIVE updates: https://t.co/GtLt7bKzns https://t.co/W2oqujuR3a'"
360,EconomicTimes,1298489097397219328,2020-08-26 05:15:00,b'Questions about Chinese stake in Paytm resurface https://t.co/zD8oxjtUt5'
361,EconomicTimes,1298489071983984642,2020-08-26 05:14:54,"b""Sonia, Mamata to convene meeting with CMs of Congress-ruled states to discuss NEET, JEE exams issue | Catch the day's #news #updates here: https://t.co/jzRXcih6hB https://t.co/HMbwhVRxQ1"""
362,EconomicTimes,1298485323458949120,2020-08-26 05:00:00,b'Is economy looking like a monopoly board? https://t.co/YZtkOeSjoG'
363,EconomicTimes,1298481547637530624,2020-08-26 04:45:00,"b""Why 5% growth could be the India's new normal https://t.co/RU3Hw8ObKw"""
364,EconomicTimes,1298477773577756672,2020-08-26 04:30:00,"b""#LeadStoryOnET | Chandrasekaran takes a leaf out of Reliance's book, vows to make Tata Motors debt-free in 3 years https://t.co/2k4HEsNRls"""
365,EconomicTimes,1298473997818949633,2020-08-26 04:15:00,"b""#LeadStoryOnET | Voda Idea slapped with showcause notice for 'misleading customers' https://t.co/9OKu4kNCP5"""
366,EconomicTimes,1298473610831515648,2020-08-26 04:13:27,"b""#Maharashtra: Death toll rises to 16 (7 males and 9 females) in the building collapse incident in #Raigad. Rescue operation is underway. \nCatch the day's #news #updates here: https://t.co/jzRXcih6hB https://t.co/CRqwHRKtDE"""
367,EconomicTimes,1298472681310846976,2020-08-26 04:09:46,"b""\xe2\x9e\xa0 India's #COVID19 case tally crosses 32 lakh mark with 67,151 fresh cases and 1,059 deaths in last 24 hrs\n\xe2\x9e\xa0 Total tally at 32,34,475 including 7,07,267 active, 24,67,759 cured/discharged/migrated &amp; 59,449 deaths: Ministry of Health\n#Coronavirus Updates: https://t.co/gQCe44t9sB https://t.co/JzWNaAmTUI"""
368,EconomicTimes,1298470770859892736,2020-08-26 04:02:10,"b""Earthquake of magnitude 3.8 hit 30 km Southeast of Baharampur, West Bengal, around 1 hour 30 minutes ago: European-Mediterranean Seismological Centre \n\nCatch the day's #news #updates here: https://t.co/jzRXcih6hB https://t.co/LXwWPvY5zK"""
369,EconomicTimes,1298470224891539456,2020-08-26 04:00:00,b'In Pics | Types of mask\n\nhttps://t.co/dY8DqlcZnz'
370,EconomicTimes,1298469709545746434,2020-08-26 03:57:57,"b'RT @ETPrime_com: Vidhi Centre for Legal Policy has one client: the government. In 7 years, it helped draft 29 laws and 35 rules &amp; regulatio\xe2\x80\xa6'"
371,EconomicTimes,1298469687047516161,2020-08-26 03:57:52,"b'RT @ETOpinion: #ETEdit | By competition, not hobbling by Fiat https://t.co/VyzwOqGDTP https://t.co/G9ZCNzvbJf'"
372,EconomicTimes,1298469663416885248,2020-08-26 03:57:46,"b'RT @ETPrime_com: Small warehousing hubs flourish in cities \n\nWith a spike in #onlineshopping during #COVID, e-commerce players are forced t\xe2\x80\xa6'"
373,EconomicTimes,1298469639140196352,2020-08-26 03:57:41,b'RT @ETOpinion: #ETEdit | A clarion call for government action https://t.co/OfxLHrim39 https://t.co/w64j2joB4T'
374,EconomicTimes,1298468567428370434,2020-08-26 03:53:25,"b'RT @ETMarkets: OPENING BELL: Sensex rises 50 points, Nifty nears 11,500; GIC Housing surges 13%, two-wheeler stocks gain up to 6% https://t\xe2\x80\xa6'"
375,EconomicTimes,1298466448180830209,2020-08-26 03:45:00,b'In Pics | Advent of new viruses\n\nhttps://t.co/k7tCvl1TwM'
376,EconomicTimes,1298462674406309888,2020-08-26 03:30:00,b'In Pics | 7 countries with high speed rail\nhttps://t.co/3zkmOuVi7Z'
377,EconomicTimes,1298458898475540480,2020-08-26 03:15:00,b'In Pics | How climate change could unleash new epidemics  https://t.co/k7tCvl1TwM'
378,EconomicTimes,1298455126852550656,2020-08-26 03:00:01,b'In Pics | Convalescent plasma as a cure COVID-19 and the politics behind it https://t.co/PBCZaiHpqy'
379,EconomicTimes,1298447575176093696,2020-08-26 02:30:00,b'In Pics | Schools battle the coronavirus amid changing WHO guidelines and infection fears\n   https://t.co/JVJsMvr4p1'
380,EconomicTimes,1298440026062229504,2020-08-26 02:00:00,b'In Pics | #DelhiMetro gears up to restart in Unlock-4\n https://t.co/ZSFpLcUlAA'
381,EconomicTimes,1298432475056799745,2020-08-26 01:30:00,b'In Pics | How safe are connected cars?\nhttps://t.co/hVxEU30l76'
382,EconomicTimes,1298424925506568193,2020-08-26 01:00:00,"b""Cautioning that India's potential output may undergo a structural downshift following the pandemic, the RBI made a strong case for deep-seated and wide-ranging reforms to regain losses and return to the path of sustainable economic growth\n \nhttps://t.co/QU0f7YNyts"""
383,EconomicTimes,1298417374719143938,2020-08-26 00:30:00,"b'The unemployment rate is higher in low-income and lower middle income countries for youth with advanced educational levels, the International Labour Organisation has said\n \nhttps://t.co/cOfc1gEjJc'"
384,EconomicTimes,1298409829187297281,2020-08-26 00:00:01,"b'There has been a surge in hiring for remote jobs in India in the last few months and work-from-home jobs witnessed a three-fold jump as compared to pre-Covid levels, a new report said\n \nhttps://t.co/9gGOffmdQF'"
385,EconomicTimes,1298402275920982016,2020-08-25 23:30:00,b'Reserve Bank of India is set to conduct a study on a few large frauds to recognize the reason behind delay in identifying these frauds\n \nhttps://t.co/UzFTxdh8Hy'
386,EconomicTimes,1298394728346550272,2020-08-25 23:00:00,"b'E-commerce marketplace #Flipkart on Tuesday said that it will transition its entire fleet to #ElectricVehicles (EVs) within the decade by joining the non-profit Climate Groups global electric mobility initiative, EV100.\n\nhttps://t.co/oy0cojew69'"
387,EconomicTimes,1298387175894134795,2020-08-25 22:30:00,"b'The 10 central trade unions have jointly condemned the government\xe2\x80\x99s announcement to privatise more airports saying it is against the interests of the commuters, and urged the government to withdraw its latest proposal.\n\nhttps://t.co/Rz9xetx49h'"
388,EconomicTimes,1298379628516642817,2020-08-25 22:00:00,"b'Renewed optimism over a U.S.-China #trade deal and a smaller-than-expected decline in German economic output fuelled a rally in European stocks on Tuesday, with Frankfurt shares hitting a 1-month high.\n\nhttps://t.co/jEwxnbpaHj'"
389,EconomicTimes,1298372077347459072,2020-08-25 21:30:00,b'India\xe2\x80\x99s central bank will resume its Federal Reserve-style Operation Twist after weak demand at two successive auctions and inflation concerns drove up yields. Sovereign bonds climbed.\n\nhttps://t.co/m1xgRo0csR'
390,EconomicTimes,1298364529781485569,2020-08-25 21:00:01,"b'According to the homegrown start-up, chicken biryani has topped the list of most-ordered dishes for the fourth year in a row\n \nhttps://t.co/zivO8nyAHF'"
391,EconomicTimes,1298356976985018369,2020-08-25 20:30:00,"b'Wastewater containing coronaviruses, such as the one behind the COVID-19 pandemic, may be a potential threat, according to a new review of studies which calls for additional filtration steps in sewage treatment plants to successfully remove viruses\n \nhttps://t.co/uJmoyYLnng'"
392,EconomicTimes,1298349429368344576,2020-08-25 20:00:00,b'RBI Committee Loan Restructuring Chairman on how India is handling the Covid crisis\n \nhttps://t.co/qBjhEHC8B2'
393,EconomicTimes,1298341877993766913,2020-08-25 19:30:00,"b""Chinese smartphone manufacturer OPPO is all set to launch its new F17 Pro, hailing it as the 'sleekest phone of 2020'\n \nhttps://t.co/godup2psa9"""
394,EconomicTimes,1298334329798418433,2020-08-25 19:00:00,"b'The tourism global industry has been devastated by the coronavirus pandemic, with USD 320 billion lost in exports in the first five months of the year and more than 120 million jobs at risk, the UN chief said\n \nhttps://t.co/vN595yMwFI'"
395,EconomicTimes,1298326779518578688,2020-08-25 18:30:00,b'Demands for fixing Bengaluru\xe2\x80\x99s civic administration structure have come back after India\xe2\x80\x99s tech capital fell by 20 slots in the Centre\xe2\x80\x99s Swachh Survekshan \xe2\x80\x94 a cleanliness survey \xe2\x80\x94 the results of which were announced last week\n \nhttps://t.co/U6YvjLvXH4'
396,EconomicTimes,1298323003101474816,2020-08-25 18:15:00,"b'Driverless car startup Luminar Technologies Inc., backed by tech billionaire Peter Thiel, is going public via a $3.4 billion merger with Gores Metropoulos Inc., bolstering efforts to get its laser sensors onto production lines of global automakers\n \nhttps://t.co/wQDQXxJp18'"
397,EconomicTimes,1298319229050069001,2020-08-25 18:00:00,"b'Chinese buyers have not only stopped snapping up iconic overseas assets, the coronavirus pandemic is ravaging the targets of deals that defined a headier era\n \nhttps://t.co/wv0YHxWQno'"
398,EconomicTimes,1298315453115195393,2020-08-25 17:45:00,"b'To become a $5 trillion economy by 2025, India needs to spend a whopping $1.4 trillion on infrastructure\n \nhttps://t.co/i2CyfBAzAC'"
399,EconomicTimes,1298311718808895489,2020-08-25 17:30:09,"b""'#TataMotors eyes near \xe2\x80\x98zero debt\xe2\x80\x99 in 3 yrs': N Chandrasekaran takes leaf out of RIL playbook | https://t.co/hp0UBZdS31 https://t.co/2ruDRSUuxn"""
