,user,tweet_id,created_at,text
171,darshanvmehta1,1298859382294290434,2020-08-27 05:46:23,b'Last day in F&amp;O today - Century Textiles....the volumes over the past few days are very good.... https://t.co/Hk1ToNqxMZ'
172,darshanvmehta1,1298858027240419328,2020-08-27 05:40:59,b'Tata Elxsi - Another Dixon type chart...slow and steady continues to move https://t.co/mgqi4mDOgv'
173,darshanvmehta1,1298856058643812353,2020-08-27 05:33:10,b'SBI these days https://t.co/GkLdqK6vMw'
174,darshanvmehta1,1298855213483167746,2020-08-27 05:29:49,b'Keeps on rallying https://t.co/eRCHgtb2QC'
175,darshanvmehta1,1298854615459328001,2020-08-27 05:27:26,b'277 to 430 https://t.co/Le2DcIWyMS'
176,darshanvmehta1,1298853567336390658,2020-08-27 05:23:16,b'Seems it will be a pharma day today'
177,darshanvmehta1,1298853448004247554,2020-08-27 05:22:48,b'Totally agree https://t.co/FBgJOTyiOg'
178,darshanvmehta1,1298846827370778626,2020-08-27 04:56:29,b'Info Edge chart looks interesting....heavy consolidation over past few days'
179,darshanvmehta1,1298829613477453824,2020-08-27 03:48:05,b'Why Welspun India is outperforming other textile peers?\n\nLargest player in towels globally\nLarge player in bedsheets \nBenefits from covid. High demand from US\nCotton prices come off by 15%\nWorking at full capacity'
180,darshanvmehta1,1298663823134429184,2020-08-26 16:49:18,"b'RT @abhijitmajumder: WhatsApp revelations in Sushant case are explosive.\nIf it wasn\xe2\x80\x99t for Arnab and @navikakumar, this case would have gone\xe2\x80\xa6'"
181,darshanvmehta1,1298663501460697088,2020-08-26 16:48:01,b'@VishalBhargava5 First the other channel anchors laughed at him and now everyone wants to follow this case....'
182,darshanvmehta1,1298548112433143809,2020-08-26 09:09:30,b'Multiple and continuous blocks happening in RIL'
183,darshanvmehta1,1298545637206589440,2020-08-26 08:59:40,b'Blue Dart volumes almost 6x of the 10 day average till now.....keep on radar.... https://t.co/GONSgNzd8r'
184,darshanvmehta1,1298516504623767552,2020-08-26 07:03:54,b'IFB Inds....A domestic brokerage sales note has highlighted growing sales of dishwashers and washing machines as key trigger. https://t.co/fXkeDdJGqd'
185,darshanvmehta1,1298505884553764864,2020-08-26 06:21:42,b'Cochin Shipyard chart https://t.co/D83EOgGWvX https://t.co/SI8tyY4JZR'
186,darshanvmehta1,1298501315341856768,2020-08-26 06:03:33,b'Midcap rally problem: Unlimited Stocks; Limited Money'
187,darshanvmehta1,1298500473951928325,2020-08-26 06:00:12,b'HAL chart....uptick after 6 days of selling https://t.co/4wuk5gRHVz https://t.co/czpDPYfIyo'
188,darshanvmehta1,1298500008979779584,2020-08-26 05:58:21,"b'Defence stocks are seeing uptrend after many days of selling...HAL, BDL, Cochin, Midhani'"
189,darshanvmehta1,1298477458002345985,2020-08-26 04:28:45,b'Dixon chart....slow and steady move https://t.co/DSszi1Dhpb'
190,darshanvmehta1,1298469902949335040,2020-08-26 03:58:43,b'Chart of Karur Vysya is very interesting...follow up buying and volumes https://t.co/fYXE45h7Hp'
191,darshanvmehta1,1298210456889221121,2020-08-25 10:47:47,b'@chirayumndra No view'
192,darshanvmehta1,1298209994471424000,2020-08-25 10:45:56,b'VA Tech approves issue of pref shares to RJ and other investors. Total 75 lk shares to 3 investors. Issue done at 160 per share.'
193,darshanvmehta1,1298189146557538305,2020-08-25 09:23:06,b'Last 3 days the vols have picked up https://t.co/AMuDqv9IyA'
194,darshanvmehta1,1298187340582498304,2020-08-25 09:15:55,b'Rallis volumes thru the roof'
195,darshanvmehta1,1298176670017363968,2020-08-25 08:33:31,b'Results just out...poor nos https://t.co/IUOYXyz6e3'
196,darshanvmehta1,1298174427171979265,2020-08-25 08:24:37,b'very good structure with good volumes - DCB Bank https://t.co/UfcQYnLnP5'
197,darshanvmehta1,1298173848056037380,2020-08-25 08:22:18,b'19 ------23 https://t.co/f4Qlhvrcu0'
198,darshanvmehta1,1298160792970227712,2020-08-25 07:30:26,b'wow https://t.co/LmxkJbCVtC'
199,darshanvmehta1,1298146420319326208,2020-08-25 06:33:19,b'Old forgotten stocks....HEG and Graphite are surging today'
