,user,tweet_id,created_at,text
0,darshanvmehta1,1302247218980646912,2020-09-05 14:08:26,"b""1 lakh followers on Twitter\n\nHeartfelt thanks to all. Let's grow knowledgeable and rich together."""
1,darshanvmehta1,1302246067866447875,2020-09-05 14:03:51,"b""Rajnath Singh told China's defence minister it should work with India for complete disengagement at earliest from all friction areas: PTI"""
2,darshanvmehta1,1302185926341214213,2020-09-05 10:04:52,b'@Kishore59099758 Aaja'
3,darshanvmehta1,1302184213349769216,2020-09-05 09:58:04,b'Happy Teachers Day \xf0\x9f\x8e\x89'
4,darshanvmehta1,1301901129287045121,2020-09-04 15:13:12,b'Vodafone Idea to raise Rs 25000 cr through issue of shares or convertible securities'
5,darshanvmehta1,1301819461628882944,2020-09-04 09:48:40,b'@Kishore59099758 panauti hai tu'
6,darshanvmehta1,1301819228991807490,2020-09-04 09:47:45,b'@AjeetSoni007 anti glare'
7,darshanvmehta1,1301818422087442433,2020-09-04 09:44:33,b'Surprise office inspection by junior boss https://t.co/IzfzuqX5kM'
8,darshanvmehta1,1301817342511333376,2020-09-04 09:40:15,b'ITC to SBI https://t.co/9hqOjUYzYe'
9,darshanvmehta1,1301806437841227776,2020-09-04 08:56:55,b'@alexandermats Get well soon boss'
10,darshanvmehta1,1301805321988399104,2020-09-04 08:52:29,b'Block done in Infratel....seems price correction only on account of block'
11,darshanvmehta1,1301804684517101569,2020-09-04 08:49:57,b'Bank Nifty rebalancing as of today. Effective Sept 7\nBandhan 74 lk shares buying\nHDFC Bank 32 lk shares buying\nSBI 63 lk shares selling\nSource: Antique'
12,darshanvmehta1,1301803843282300930,2020-09-04 08:46:37,b'Days high Ashok Leyland https://t.co/zFjTuNpLt2'
13,darshanvmehta1,1301778921264799745,2020-09-04 07:07:35,b'RBI: LOAN LIMITS FOR RENEWABLE ENERGY HAVE BEEN INCREASED\n\nSW Solar\nInox Wind'
14,darshanvmehta1,1301770918402781184,2020-09-04 06:35:47,"b'IndiGo may not proceed with its plan to raise funds via a qualified institutions placement if revenues rise, Business Standard reports, citing CEO Ronojoy Dutta.'"
15,darshanvmehta1,1301766749457543168,2020-09-04 06:19:13,b'2 days behaved well and now back to old self....1851'
16,darshanvmehta1,1301764709348077573,2020-09-04 06:11:06,b'RT @ETNOWlive: .@PrakashJavdekar: We want to announce the scrappage policy very soon. Will definitely discuss the demand for #GST reduction\xe2\x80\xa6'
17,darshanvmehta1,1301763223469748224,2020-09-04 06:05:12,b'Jubilant Life results today...imp thing to watch is timeline of demerger and commentary on remdesivir sales'
18,darshanvmehta1,1301757201141260295,2020-09-04 05:41:16,b'MSTC surges on this news https://t.co/zFjTuNpLt2'
19,darshanvmehta1,1301755932280381441,2020-09-04 05:36:14,b'Big news for auto sector.....Ashok Leyland biggest beneficiary https://t.co/pQUh22mJ7k'
20,darshanvmehta1,1301728533387960321,2020-09-04 03:47:21,b'Good fund raising plan by 5paisa Capital\n\nhttps://t.co/1ZBtumideR'
21,darshanvmehta1,1301699910928986119,2020-09-04 01:53:37,"b'Why this may be the best time for Amazon, Verizon to invest in Voda Idea\n\nhttps://t.co/pGJWJdd8cz'"
22,darshanvmehta1,1301695191280005122,2020-09-04 01:34:52,"b'Silver Lake is in talks to invest about $1b in Reliance Retail at a valuation of about $57b, FT reports, citing unidentified people with direct knowledge of the matter.'"
23,darshanvmehta1,1301458826269351937,2020-09-03 09:55:38,b'Conviction paying off https://t.co/AYSn49JG38'
24,darshanvmehta1,1301441967906119681,2020-09-03 08:48:39,b'Keep on radar https://t.co/7fftK590ko'
25,darshanvmehta1,1301441756731379712,2020-09-03 08:47:49,b'surging and how https://t.co/iLGABPZ732'
26,darshanvmehta1,1301432463726505984,2020-09-03 08:10:53,b'Page inds in focus https://t.co/ndf3rrBU4k'
27,darshanvmehta1,1301422420473966593,2020-09-03 07:30:58,b'Strong comments by Page mnagement https://t.co/JVburAImFx https://t.co/NLaQdONLT1'
28,darshanvmehta1,1301422026293346305,2020-09-03 07:29:24,b'Page Inds weak nos....probably expected....focus shifts to commentary now'
29,darshanvmehta1,1301393377124990981,2020-09-03 05:35:34,b'Positive for Airtel https://t.co/6vURnaxS4o'
30,darshanvmehta1,1301392377727254528,2020-09-03 05:31:36,b'CNBC: Payment of 18000 cr by Airtel can lead to 3 year moratorium....This is positive news'
31,darshanvmehta1,1301388424553754624,2020-09-03 05:15:53,b'Idea fund raising plans tomorrow....watch for Grasim also https://t.co/CS2jiFwFMP'
32,darshanvmehta1,1301387175745843200,2020-09-03 05:10:55,b'All time high https://t.co/eJytx5I2xR'
33,darshanvmehta1,1301385726945181696,2020-09-03 05:05:10,"b""Idea has 28 cr customers....that's the answer why anyone would want to invest in the company.... multiple media reports have said many global cos in talks to buy stake"""
34,darshanvmehta1,1301377637269422081,2020-09-03 04:33:01,b'Both CDSL and BSE moving https://t.co/iP9IQMVQzJ'
35,darshanvmehta1,1301371170080526336,2020-09-03 04:07:19,b'M&amp;M in new trajectory now https://t.co/Gi30ssRfFo'
36,darshanvmehta1,1301370926307532800,2020-09-03 04:06:21,b'Up 8% https://t.co/GOCD5pwqDa'
37,darshanvmehta1,1301368518923833347,2020-09-03 03:56:47,"b'Anti dumping duty imposed on Ciprofloxacin Hydrochloride\n\nKey players: Aarti Drugs, Neuland, Cipla, Sun Pharma https://t.co/W6ZVGsOW2t'"
38,darshanvmehta1,1301367381336313857,2020-09-03 03:52:16,b'M&amp;M now at 52 week high'
39,darshanvmehta1,1301366121069572096,2020-09-03 03:47:16,b'Watch for Infratel also https://t.co/DBmIpnZZ1r'
40,darshanvmehta1,1301346789782515713,2020-09-03 02:30:27,b'Interesting to watch the telecom space....Tariff hikes may be coming as per IIFL https://t.co/9vEclDC4rt'
41,darshanvmehta1,1301346369211256832,2020-09-03 02:28:46,b'Spark upgrades Jubilant Food with target of 2600 https://t.co/NI7pMXArrJ'
42,darshanvmehta1,1301343961454239744,2020-09-03 02:19:12,b'Edelweiss on Jubilant Food https://t.co/AKpoBa1hZl'
43,darshanvmehta1,1301338663008088064,2020-09-03 01:58:09,"b'Vodafone-Idea likely to get a lifeline from Amazon, Verizon\n\nhttps://t.co/s2NWl7C5pn'"
44,darshanvmehta1,1301337520920080384,2020-09-03 01:53:37,b'CLSA on Vedanta lowering book value https://t.co/baWKJ2CZH9'
45,darshanvmehta1,1301209957665251328,2020-09-02 17:26:43,"b'Vodafone Group Plc\xe2\x80\x99s India unit is no longer considering bankruptcy, according to people with knowledge of the matter.\n https://t.co/uFXxzOJhWG'"
46,darshanvmehta1,1301198709485531137,2020-09-02 16:42:02,b'Valiant organics from Friday will be shifted to the mainboard platform from SME platform currently'
47,darshanvmehta1,1301177727752364032,2020-09-02 15:18:39,b'So for a perspective...Heparin is made from pig intestines or cattle lungs...No Indian co makes this...Doubt anyone will also make this....Will be imported but this is a big blow to China....Its a big export product for China into India.... https://t.co/mf8VHDpAJt'
48,darshanvmehta1,1301169492332957700,2020-09-02 14:45:56,b'Philip Capital: See this as another step by Vedanta to tone down expectation of minority shareholders for delisting price. Q4 results BV was 146.9 per share. Management has excluded capital reserves while calculating. https://t.co/xenr14d9zQ'
49,darshanvmehta1,1301129322439127041,2020-09-02 12:06:18,b'What is working for Jubilant Food in covid?\n- preferred delivery outfit due to brand and safety concerns\n- delivery charges\n- own delivery people rather than swiggy etc\n- food that can be reheated \n- rent re negotiation'
50,darshanvmehta1,1301106254513758208,2020-09-02 10:34:39,"b""@patil_shesh It's based on what people say and what I have seen"""
51,darshanvmehta1,1301096527406882816,2020-09-02 09:55:59,b'Idea will most likely come out of F&amp;O ban tomorrow'
52,darshanvmehta1,1301094036141346816,2020-09-02 09:46:06,b'Idea days high....watch for Infratel (market believes Idea will survive) https://t.co/AYSn49JG38'
53,darshanvmehta1,1301093295255298049,2020-09-02 09:43:09,b'20% UC https://t.co/6RozdxshpL'
54,darshanvmehta1,1301092761236504576,2020-09-02 09:41:02,b'@varinder_bansal Congrats. Good show VB.'
55,darshanvmehta1,1301088180842586112,2020-09-02 09:22:50,b'Tractors on fire https://t.co/UXCVEFXJ6H https://t.co/6cvyIs8DFI'
56,darshanvmehta1,1301086656963858434,2020-09-02 09:16:46,b'Jubilant Food days high https://t.co/KOiZjiN5iq'
57,darshanvmehta1,1301083548732911617,2020-09-02 09:04:25,b'Whose exclusive? https://t.co/n4Rse4df2i'
58,darshanvmehta1,1301082346150486017,2020-09-02 08:59:38,b'1200 cross.....best stock if u just want to play tractors https://t.co/N8w0kXKiaG'
59,darshanvmehta1,1301081487756853249,2020-09-02 08:56:14,b'RENT RE - NEGOTIATION.....most imp words in release https://t.co/RdUxVVZ42s https://t.co/d66iMbWpnh'
60,darshanvmehta1,1301080007863799809,2020-09-02 08:50:21,b'Most imp thing to see for Jubilant Food.... https://t.co/AhnuPrn29T'
61,darshanvmehta1,1301079675066703872,2020-09-02 08:49:02,b'Dont see SSSG...commentary in press release is very good https://t.co/Snj4YpMjLy'
62,darshanvmehta1,1301077615856373760,2020-09-02 08:40:51,b'Superb nos from Jubilant Food...waiting for commentary now'
63,darshanvmehta1,1301067037305761794,2020-09-02 07:58:49,b'MS believes that Oman asset sale can be re rating trigger for JSPL https://t.co/AbQ0ImiTW3'
64,darshanvmehta1,1301065946082111489,2020-09-02 07:54:28,b'Good chart structure Escorts https://t.co/cFYAZ2Vfwu'
65,darshanvmehta1,1301065812048920576,2020-09-02 07:53:56,b'Rallies after big block deal https://t.co/FKfDA0ADgS'
66,darshanvmehta1,1301048368022470658,2020-09-02 06:44:37,b'Watch for Deepak Nitrite...Phenol spreads have again started moving higher (Image from B&amp;K Note) https://t.co/knMQIpOizs'
67,darshanvmehta1,1301039426936565761,2020-09-02 06:09:06,"b'Tractors co reporting strong nos....Sonalika 10,206 units 6,412 units last year....'"
68,darshanvmehta1,1301037886205079553,2020-09-02 06:02:58,b'BSE market cap 2270 cr\nStake in CDSL worth Rs 1000 cr https://t.co/KGjbJ5GRPM'
69,darshanvmehta1,1301037591983054848,2020-09-02 06:01:48,b'BSE moves on CDSL move... https://t.co/8nXob7dKkT'
70,darshanvmehta1,1301030779376418816,2020-09-02 05:34:44,b'CDSL rallies as Monarch initiates coverage https://t.co/3lBSKI6eS0'
71,darshanvmehta1,1301028491240955904,2020-09-02 05:25:38,b'This is my observation...domestic brokerages do much better research than foreign ones....'
72,darshanvmehta1,1301023783159881736,2020-09-02 05:06:56,b'JSPL in focus...Positive news\n\nhttps://t.co/36mHfYoWXd'
73,darshanvmehta1,1301016335728533505,2020-09-02 04:37:20,b'@mehul_ahire It affects all right now....mainly due to late payouts'
74,darshanvmehta1,1301015592825102341,2020-09-02 04:34:23,b'Many people are still having margin issues due to the new norms....Feel this should get settled in few days'
75,darshanvmehta1,1301015054377050112,2020-09-02 04:32:15,b'AGR is out....Not changing my view https://t.co/gCpWVQwAqU'
76,darshanvmehta1,1301006885022097409,2020-09-02 03:59:47,b'Auro chart....seems selling over as per chart https://t.co/xbYDeND5TI'
77,darshanvmehta1,1301002244083523585,2020-09-02 03:41:21,b'@sridhar_chinna it comes on exchanges'
78,darshanvmehta1,1301001996984414211,2020-09-02 03:40:22,b'Bajaj Auto sales at 3.56 lk units vs est of 3.25 lk units'
79,darshanvmehta1,1301000210991071232,2020-09-02 03:33:16,b'Pre Market Blocks\nInfosys 14 lk shares\nRIL 12 lk shares'
80,darshanvmehta1,1300999700393242624,2020-09-02 03:31:14,b'RESULTS TODAY\nArvind Fashions\nCoal India\nDish TV\nInfibeam Avenues\nJubilant FoodWorks\nSadbhav Engineering'
81,darshanvmehta1,1300995286953684992,2020-09-02 03:13:42,"b'Jubilant Life Sciences seeks nod to roll out Remdesivir tablet: According to the proposal, the company is exploring the possibility of launching 20 mg sublingual tablets.....Positive for company'"
82,darshanvmehta1,1300993650210398210,2020-09-02 03:07:12,b'Dabur chart looks interesting....after days of selling some indication of buying....good vols yesterday....keep on radar https://t.co/a1mrrfzgCH'
83,darshanvmehta1,1300970571853750273,2020-09-02 01:35:29,b'JPM sees further upside to steel prices https://t.co/05V2j3jpuX'
84,darshanvmehta1,1300966440049152001,2020-09-02 01:19:04,b'CLSA on Telecom https://t.co/h0s916Upjc'
85,darshanvmehta1,1300731350203248643,2020-09-01 09:44:54,b'Why steel stocks rallying?\n\nIndian steel producers have increased export price of HRC by USD 15/ton\n\nExpectation of price hike of Rs 2000 / ton in domestic markets in few days\n\nDealers have already started hiking the prices'
86,darshanvmehta1,1300705907517521921,2020-09-01 08:03:48,b'Spark Research view on telecom AGR verdict https://t.co/RDMdTZ05RD'
87,darshanvmehta1,1300689568170045440,2020-09-01 06:58:53,"b'MAHINDRA AUG. TRACTOR SALES 23,503 UNITS....very good nos'"
88,darshanvmehta1,1300679999519748096,2020-09-01 06:20:52,b'Big positive for Bharti Aitrel https://t.co/VoeeNiKPGF'
89,darshanvmehta1,1300677514205884422,2020-09-01 06:10:59,b'First view seems verdict is positive for Bharti Airtel'
90,darshanvmehta1,1300650678348513280,2020-09-01 04:24:21,"b'MARUTI SUZUKI AUG. TOTAL SALES 124,624 UNITS'"
91,darshanvmehta1,1300641634720256000,2020-09-01 03:48:25,b'M&amp;M in focus now after strong Escorts nos'
92,darshanvmehta1,1300369110023303168,2020-08-31 09:45:30,b'Volumes done show most of MSCI selling is done....keep on radar https://t.co/ivVzTPTq59'
93,darshanvmehta1,1300366270487883779,2020-08-31 09:34:13,b'And more come https://t.co/Hud9cZObzG https://t.co/KXuRq3vblQ'
94,darshanvmehta1,1300365688058441729,2020-08-31 09:31:54,b'Large blocks in Airtel.....note today is adjustment for the big MSCI based selling...which should get over today'
95,darshanvmehta1,1300359970836213761,2020-08-31 09:09:11,b'Hope many were able to get out https://t.co/HR2t3IonjO'
96,darshanvmehta1,1300343086627782656,2020-08-31 08:02:05,"b'RT @Perpetuity_H2W: Aggregate Net Debt of Nifty Pharma Co.s reduced by ~42% in FY20 after peaking in FY19. \n\nMajor contributors of the ~10,\xe2\x80\xa6'"
97,darshanvmehta1,1300332626599788544,2020-08-31 07:20:31,b'Pain in broader markets today https://t.co/VAOMbzUGNl'
98,darshanvmehta1,1300311018778714112,2020-08-31 05:54:40,b'Why selling happening in broader markets https://t.co/A4YcN7Ob1w'
99,darshanvmehta1,1300293866789183489,2020-08-31 04:46:30,b'BPCL good chart formation with decent volumes https://t.co/PKyzJOr2z6'
100,darshanvmehta1,1300291614066094081,2020-08-31 04:37:33,b'Interesting note....Nomura raises Glenmark target to 727 https://t.co/uoFbzBm2m4'
101,darshanvmehta1,1300289616105226241,2020-08-31 04:29:37,b'This reading failed....nothing opened in unlock 4 and that put pressure https://t.co/7iJaz4vP7Q'
102,darshanvmehta1,1300287417694343170,2020-08-31 04:20:53,b'Watch for Jai Corp and RIIL\n\nGVK Adani Airport deal\nAchieving Financial Closure of the Navi Mumbai International Airport project by Adani at the earliest in order to commence construction. https://t.co/uD2HxxH2kq'
103,darshanvmehta1,1300284778957008897,2020-08-31 04:10:24,b'Adani Enterprises to buy controlling stake in Mumbai Airport'
104,darshanvmehta1,1300263843675865088,2020-08-31 02:47:12,b'RESULTS TODAY\nArvind\nBharat Dynamics\nDredging Corp\nGujarat Narmada Fertilizers\nJai Corp\nJindal Poly Films \nJK Cement\nNHPC\nShree Renuka Sugar\nSpandana Sphoorty Financial'
105,darshanvmehta1,1300262615109656576,2020-08-31 02:42:19,b'Seems RIL is on overdrive.....https://t.co/Gq6AqqQnLJ https://t.co/M8EeLNcUcV'
106,darshanvmehta1,1300261885812461568,2020-08-31 02:39:25,b'The consensus view on the RIL Future deal is that it benefits RIL. The other aspect is the benefit also comes in to lenders and banks. No one has much clarity on how the deal affects Future Group stocks.'
107,darshanvmehta1,1300260254647681024,2020-08-31 02:32:57,b'Kubota Concall (Impact on Indian Tractor Market)\nWatching trends at M&amp;M for Indian markets\nMahindra initiated the strong financing programs and these became established\nDeere and Kubota following strong financing programs\nMahindra excels in low-priced 40-50hp products made in Ind'
108,darshanvmehta1,1300258174444863490,2020-08-31 02:24:41,b'MS speaks about the decade ahead for RIL and where it may invest https://t.co/BOjKQPQW6x'
109,darshanvmehta1,1300256949213175813,2020-08-31 02:19:48,"b'CS view on Dmart (RIL deal)\nWith the weaker competitor being acquired by a stronger one, the development is negative for Avenue which now becomes a distant No. 2 in a largely two player grocery market. Grocery revenue of Reliance becomes 2.5x larger than DMart post transaction.'"
110,darshanvmehta1,1300255437908930560,2020-08-31 02:13:48,b'JPM highlights the 4 pillars of the RIL deal https://t.co/RD6crJlJZ4'
111,darshanvmehta1,1300254688311296002,2020-08-31 02:10:49,b'Here is how UBS values RIL https://t.co/E1sO8Rx8ZW'
112,darshanvmehta1,1300254000135114753,2020-08-31 02:08:05,b'Macquarie highlights some risks into RIL Future deal....read the other side of the argument https://t.co/bnEAUgXrui'
113,darshanvmehta1,1300252279090458625,2020-08-31 02:01:15,b'CLSA on RIL https://t.co/GKolEQbTi2'
114,darshanvmehta1,1300252175994503169,2020-08-31 02:00:50,b'RIL miles ahead https://t.co/SSEah7NUhx'
115,darshanvmehta1,1300109427832311808,2020-08-30 16:33:37,b'@mayurvmehta Isme woh kahan se beech mein aaya?'
116,darshanvmehta1,1300102910081003520,2020-08-30 16:07:43,b'Not a word on Norway and Sweden by our so called secular media....'
117,darshanvmehta1,1300100102300684289,2020-08-30 15:56:33,b'Haitong on RIL Future deal https://t.co/rGUaZpKw1n'
118,darshanvmehta1,1300099536413585408,2020-08-30 15:54:18,b'@itzsai97 I never said that....your understanding is wrong'
119,darshanvmehta1,1300089021066915840,2020-08-30 15:12:31,b'One of the most iconic brand ever created in India is Thums Up....I guess most millenials will prefer it to Coca Cola or Pepsi.....'
120,darshanvmehta1,1299933833022910464,2020-08-30 04:55:52,"b""Record single-day spike of 78,761 COVID-19 cases pushes\xc2\xa0India's virus caseload to 35,42,733, death toll rises to\xc2\xa063,498 as per Bloomberg"""
121,darshanvmehta1,1299741918482501632,2020-08-29 16:13:16,b'Analysing which share to buy on RIL Future deal https://t.co/H34DPNM34Y'
122,darshanvmehta1,1299725264050507776,2020-08-29 15:07:05,b'RIL Future deal done finally https://t.co/hO4JTmwsX8'
123,darshanvmehta1,1299715980453576704,2020-08-29 14:30:11,b'Now Macquarie jumps in on SBI Express......I think brokerages should now be honest....just say na....raising target price as price is going up and i missed out....u will have more respect https://t.co/tj4I55UEOK'
124,darshanvmehta1,1299701698676453378,2020-08-29 13:33:26,b'Is #Sadak2 so bad that even the usual ass licking critics are panning it and calling it a disaster'
125,darshanvmehta1,1299691066761773057,2020-08-29 12:51:12,b'RBI may not extend moratorium on repayment of loans beyond Aug 31 as per PTI.....this is positive for banks'
126,darshanvmehta1,1299661549922123777,2020-08-29 10:53:54,b'Done with both seasons.....really good series....loved it https://t.co/FyKhSo72F6'
127,darshanvmehta1,1299402679609745411,2020-08-28 17:45:15,b'For all the Karate kid fans.....cobra kai now on Netflix....seems to be a cool series'
128,darshanvmehta1,1299320281140355073,2020-08-28 12:17:49,b'Lol https://t.co/02SXVglvl1'
129,darshanvmehta1,1299284912533454848,2020-08-28 09:57:17,b'Indusind Bank https://t.co/Qc6kenGUow'
130,darshanvmehta1,1299280354457477120,2020-08-28 09:39:10,b'Bank Nifty....super chart https://t.co/Wm9Wh8xMaj'
131,darshanvmehta1,1299279679250071552,2020-08-28 09:36:29,b'Big blocks in Bajaj Finance currently happening'
132,darshanvmehta1,1299279327943520256,2020-08-28 09:35:05,b'Too much strength in Banks.....Nifty needs RIL https://t.co/SVIOUG1CRQ'
133,darshanvmehta1,1299278141408514053,2020-08-28 09:30:22,b'Set to break out...vols have picked up https://t.co/ZuV7E0S0nR'
134,darshanvmehta1,1299274343629742080,2020-08-28 09:15:17,b'Keep this stock on radar....charts show a big breakout possible https://t.co/BSerTrWiW1'
135,darshanvmehta1,1299272896750133250,2020-08-28 09:09:32,b'Info Edge in focus....interesting note by HSBC...says that Zomato could add +USD2bn M-cap to Info Edge over 3-4 years....Chart setup is also very good https://t.co/WoI18N8Qgv'
136,darshanvmehta1,1299265481954586625,2020-08-28 08:40:04,b'At 52 week high...Sun Pharma https://t.co/HShTkbqpak https://t.co/H85vd4eWAk'
137,darshanvmehta1,1299254022814146560,2020-08-28 07:54:32,b'@tinucherian Charts is the trailer....full movie usually follows later'
138,darshanvmehta1,1299253399754399745,2020-08-28 07:52:04,b'Vodafone Idea volumes are thru the roof....keep on radar...'
139,darshanvmehta1,1299252914473451520,2020-08-28 07:50:08,b'@I_am_Viraln This is different'
140,darshanvmehta1,1299249101612015616,2020-08-28 07:34:59,b'@akjceplc Indus already has moved over past few days'
141,darshanvmehta1,1299248541185925120,2020-08-28 07:32:45,b'Next few days focus will shift from cash markets to fno markets as new margin rules will kick in next week. No announcement of postponement.'
142,darshanvmehta1,1299246095587893248,2020-08-28 07:23:02,b'RT @YatinMota: Auto Sales Estimates for the Month of August 2020 \n\n@CNBC_Awaaz @CNBCTV18Live https://t.co/38uS6FSmUB'
143,darshanvmehta1,1299245985655185408,2020-08-28 07:22:36,b'And breaks out..... https://t.co/PKajFmkOoy'
144,darshanvmehta1,1299241364853370880,2020-08-28 07:04:14,b'Telecom stocks doing well today....Airtel moves to days high'
145,darshanvmehta1,1299229657229713408,2020-08-28 06:17:43,b'The big boys are now firing.....Kotak Bank and HDFC Bank....Bank Nifty in focus'
146,darshanvmehta1,1299226108865335297,2020-08-28 06:03:37,b'DRL says US FDA closed all warning letters.....all known....nothing new'
147,darshanvmehta1,1299218076991287296,2020-08-28 05:31:42,b'Multiple large blocks in Vodafone Idea'
148,darshanvmehta1,1299214816385536001,2020-08-28 05:18:45,b'PVR....interesting chart structure aided b volumes https://t.co/Kne4WRh4a4'
149,darshanvmehta1,1299211232273035264,2020-08-28 05:04:30,b'This is moving very well https://t.co/zCrviutpNA'
150,darshanvmehta1,1299207723041447937,2020-08-28 04:50:33,b'1080 to 1500+....a good spot https://t.co/ZoWF4IHucw'
151,darshanvmehta1,1299197944092962817,2020-08-28 04:11:42,b'Sun Pharma very interesting chart...its seems its towards the end of the consolidation phase...keep on radar https://t.co/qoLWUby7VT'
152,darshanvmehta1,1299192908663255040,2020-08-28 03:51:41,b'ISec large deal 331 cr worth'
153,darshanvmehta1,1299192292704567297,2020-08-28 03:49:15,b'Keep watch on Sun Pharma....very strong comments in AGM yesterday'
154,darshanvmehta1,1299182599626133510,2020-08-28 03:10:44,"b'National Stock of Exchange of India Ltd.\xe2\x80\x99s plan to sell shares worth 100 billion rupees via an initial public offering will likely get approval from market regulator Securities and Exchange Board of India soon, the Mint reported, citing people it didn\xe2\x80\x99t identify.'"
155,darshanvmehta1,1299176453490184196,2020-08-28 02:46:18,b'RT @jayeshkhilnani: Stocks excluded from F&amp;O effective today \nCentury Textiles\nUjjivan Financial \nEquitas Holdings \n\n#StocksToTrade #stocks\xe2\x80\xa6'
156,darshanvmehta1,1299174093623709700,2020-08-28 02:36:56,b'Results Today\nCareer Point\nFuture Enterprises\nInox Wind\nKhadim India\nRico Auto\nSJVN\n\nLists Today\nMax India (post scheme of arrangement)\n\nAGMS\nBajaj Electricals\nJK Lakshmi Cement\nManappuram\nMarico\nTata Communications'
157,darshanvmehta1,1299170058480934912,2020-08-28 02:20:54,b'Interesting data from MS....Fund flows into Indian Online firms in August. Fund inflow trends continue to be lower than pre-Covid levels but were better than the initial months of the outbreak. 60% of flows came to education sector. https://t.co/zVqmRj7oce'
158,darshanvmehta1,1299169554073968641,2020-08-28 02:18:53,b'MS view on management changes at ACC and Ambuja https://t.co/DITMuIIRrg'
159,darshanvmehta1,1299169103492476928,2020-08-28 02:17:06,b'Bofa says steel division demerger can unlock value for NMDC https://t.co/0m0P4wYrUh'
160,darshanvmehta1,1299153472751689728,2020-08-28 01:14:59,b'No stocks in fno ban https://t.co/tGV0BxeczR'
161,darshanvmehta1,1299001325456257026,2020-08-27 15:10:24,"b""For people who want to understand....there is no FTSE based selling that will happen...it's just that buying won't come...won't rule out a knee jerk reaction tomorrow as some of these stocks had rallied recently on expectation of buying https://t.co/OjKdGf26hH"""
162,darshanvmehta1,1299000033698750467,2020-08-27 15:05:16,b'Hahaha https://t.co/na4jXrhf3j'
163,darshanvmehta1,1298934971013328898,2020-08-27 10:46:44,b'Here is release by FTSE https://t.co/Y5L4r17Q7F https://t.co/tRzL7Do8oc'
164,darshanvmehta1,1298933935158648832,2020-08-27 10:42:37,"b'FTSE cancels inclusion of hdfc bank, kotak bank and indusind bank....trying to get more....some error on FTSE part as per some brokerages'"
165,darshanvmehta1,1298885694140497920,2020-08-27 07:30:56,b'Good nos by Avanti Feeds'
166,darshanvmehta1,1298879620268212224,2020-08-27 07:06:48,b'RIL and PEL....very similar chart structures https://t.co/s5uC0L0reO'
167,darshanvmehta1,1298876281866424320,2020-08-27 06:53:32,b'Intraday chart of Bandhan Bank...going from strength to strength https://t.co/5Q1zZmFNxu'
168,darshanvmehta1,1298870037126602752,2020-08-27 06:28:43,b'INDIA COURT HALTS BANKRUPTCY CASE AGAINST ANIL AMBANI\n\nINDIA COURT SAYS ANIL AMBANI NOT TO SELL ASSETS FOR NOW\n\nBloomberg'
169,darshanvmehta1,1298869387395362817,2020-08-27 06:26:08,b'NACL Inds hits 52 week high. Very high volumes for past 2 days. Yesterday company reported very strong results....managed to grow profits QoQ and YY https://t.co/9REFsWWFil'
170,darshanvmehta1,1298863319537786880,2020-08-27 06:02:01,b'Bata - Very good chart structure + big beneficiary on unlocking of economy.... https://t.co/Mtw9VfwfOU'
